Document;Topic;Name;Top_n_words;Probability;Representative_document;model
 evaluierung der sozialen absicherung der gruppe  der selbstständigen im rahmen der zusammenführung der träger sva und svb zur svs hochqualitative abgestufte   flächendeckende und wohnortnahe  gesundheitsversorgung  aufwertung der bundeszielsteuerungskommission  evaluierung und stärkung der sektorübergreifenden  zusammenarbeit z  b  abstimmung im bereich der  heilmittel  telefonische erstberatung  aufwerten und  weiterentwickeln  telemedizinische behandlung bestmöglich umsetzen  weiterentwicklung der ecard als schlüssel für  papierlose prozesse unter berücksichtigung des  datenschutzes  eimpfpass erezept ebefund etransportschein emedikation  digitalisierung auch in medizinischer forschung  diagnose und behandlung vorantreiben  ausnahmslose nutzung von anonymisierten daten  zu wissenschaftlichen zwecken   wissenschaftliche evaluierung der implementierung  von international classification of primary care  ausbau der primärversorgung die den bedürfnissen  der versicherten entgegenkommt z  b  etablierung von allgemeinmedizinischen akutordinationen vor  oder in den spitälern zur vorgelagerten versorgung  ausbau von pve und facharztzentren  flexible  kooperationsmodelle  abschaffung der unechten ustbefreiung bei vermietung an ärztinnen und ärzte  stärkung der integrierten versorgung bei chronischen krankheiten ausbau von diseasemanagementprogrammen  wohnortnahe versorgung der bevölkerung durch  niedergelassene kassenärztinnen und kassenärzte  fachärztin bzw facharzt für allgemeinmedizin   attraktivierung der allgemeinmedizinerausbildung  klinischpraktisches jahr finanzieren   ziel integration der inhalte der basisausbildung um  das klinischpraktische jahr  erweiterung der vertragsarztmodelle aufbauend  auf dem heutigen vertragspartnerrecht soll dieses  weiterentwickelt und ausgebaut werden um die  versorgung vor allem im ländlichen raum sicherzustellen;5.0;5_pflege_familien_ausbau_kinder;pflege - familien - ausbau - kinder - versorgung - menschen - betreuung - pflegende - maßnahmen - angehörige;1.0;1.0;model 1
menschen mit behinderung sollen einen freien zugang zu  allen bildungsformen bis hin zum tertiären bildungsweg  haben dafür müssen den bildungseinrichtungen die nö  t ige ausstattung und hilfsmittel bereitgestellt lehrpersonen  und assistentinnen bzw assistenten ausgebildet und das  berufs  au sbildungsangebot ausgebaut und ent  s prechende  barrieren abgebaut werden;2.0;2_schulen_weiterentwicklung_pädagogen_hochschulen;schulen - weiterentwicklung - pädagogen - hochschulen - pädagogischen - schülerinnen - evaluierung - elementarpädagogik - ausbau - lehre;1.0;1.0;model 1
 der zweckzuschuss in der avereinbarung in  der elementarpädagogik wird ab dem kindergartenjahr  wesentlich erhöht;2.0;2_schulen_weiterentwicklung_pädagogen_hochschulen;schulen - weiterentwicklung - pädagogen - hochschulen - pädagogischen - schülerinnen - evaluierung - elementarpädagogik - ausbau - lehre;1.0;1.0;model 1
 aus und weiterbildungsoffensive für pädagoginnen  und pädagogen durch einen bedarfsgerechten  ausbau des dafdazstudiums   verankerung verpflichtender dazmodule für alle  studierenden in der pädagoginnenbildung neu  sprachlernen durch beziehung einsatz von sprachstimulierenden techniken im pädagogischen alltag  stärken  aktive information über den bestehenden erstsprachenunterricht im zuge der schuleinschreibung und  stärkere einbeziehung der sprachlehrkräfte in den  stammlehrkörper starke schulen brauchen gute  organisation bedarfsgerechte  ressourcen und moderne lehr und  lerninhalte  lehrpläne modernisieren ausarbeitung und flächendeckende einführung von neuen kompakt und  konkret gehaltenen lehrplänen in der primar und  sekundarstufe   fokussierung der neuen lehrpläne auf kompetenzvermittlung und klare unterrichtsziele  als wesentliche ziele werden das verbindliche  beherrschen der grundkompetenzen erachtet  die förderung der interessen und hochbegabungen und die berücksichtigung von zeitgemäßen lehr und lerninhalten wie klimawandel und  ökologisch verantwortungsbewusstes handeln  sprachliche bildung wirtschaftsbildung und  financial literacy politische bildung inklusive  staatskunde und medienkompetenz dabei steht  die persönlichkeitsbildung der jungen menschen  immer im mittelpunkt;2.0;2_schulen_weiterentwicklung_pädagogen_hochschulen;schulen - weiterentwicklung - pädagogen - hochschulen - pädagogischen - schülerinnen - evaluierung - elementarpädagogik - ausbau - lehre;1.0;1.0;model 1
die grundlage für diesen fortschritt bildet eine flächendeckende technologieneutrale breitbandversorgung in  ganz österreich eine umfassende breitbandstrategie  sorgt für effizienten und raschen ausbau der benötigten  breitbandinfrastrukturen empfehlungen des rechnungshofes im bereich digitale infra  s trukturen werden dabei  berücksichtigt;3.0;3_forschung_bereich_verwaltung_europäischen;forschung - bereich - verwaltung - europäischen - menschen - aufbauend - prüfung - digitalen - open - grundlagenforschung;1.0;1.0;model 1
flächendeckende technologieneutrale breitbandversorgung  österreichweit sicherstellen  gvorreiterrolle weiter ausbauen und anwendung  für neue technologien autonomes fahren internet  of things etc mit telekomanbietern vorantreiben  aufbau der infrastruktur unter einhaltung der  höchstmöglichen sicherheitsstandards in  zusammenarbeit mit mobilfunkbetreibern  einsatz auf euebene um europas technologieautonomie im bereich g und all seiner anwendungen sicherzustellen und abhängigkeit von  drittstaaten zu vermeiden bei hardware und  softwarelösungen  berücksichtigung wissenschaftlicher erkenntnisse insbesondere der vom parlament beauftragten technikfolgenabschätzung zu g mobilfunk und gesundheit sowie der erkenntnisse  der who und der öaw  breitbandstrategie  weiterentwickeln und glasfaserausbau vorantreiben  ziel für  flächendeckende versorgung mit  festen und mobilen gigabitanschlüssen vermeidung einer digitalen kluft zwischen stadt  und land besonderer fokus hinsichtlich glasfaserausbau in gewerbegebieten und öffentlichen einrichtungen einsatz von neuen technologien laufend evaluieren um ländlichen raum rasch zu erschließen  z b  komplementäre technologien für die  lastmileproblematik testen glasfaser bis  zum ortskern kabellose weiterverbindung zum  haushalt  ausbau des backbone austria und der backhauls  vorantreiben  breitbandmilliarde neu strukturieren förderungen können ganzjährig beantragt werden klar  definierte qualitative und temporäre ausbauverpflichtungen mit sperre des fördererwerbs bei  nichteinhaltung  anpassen der breitbandförderbedingungen  mit anhebung auf  mbits zum abruf von  fördergeldern  schließung eines fiber und gpaktes zwischen bundesregierung telekommunikationsunternehmen ländern und landeserrichtungsgesellschaften zur erstellung eines ausbauplans  verbesserte koordination zur hebung von  synergien bei bauvorhaben bei gleichzeitiger  vermeidung volkswirtschaftlich nachteiliger  investitionen  im zuge des breitband und mobilfunkpakts  wird eine empfehlung für mehrfamilienhäuser  und betriebsgebäude zur verlegung einer  leerverrohrung für etwaige glasfaseranbindung  inkludiert;3.0;3_forschung_bereich_verwaltung_europäischen;forschung - bereich - verwaltung - europäischen - menschen - aufbauend - prüfung - digitalen - open - grundlagenforschung;1.0;1.0;model 1
 digitale aktivitäten der bundesinstitutionen abstimmen cdos beibehalten ressort  ü bergreifende  projekte umsetzen  building information modelling bim verstärkt in der  öffentlichen beschaffung berücksichtigen  digitalisierung von kunstschätzen durch virtuelle  darstellung von sehenswürdigkeiten auf nationalen  und europäischen plattformen sollen in den nächsten jahren die wertvollsten teile unseres kulturellen  erbes weiter digitalisiert und so weltweit barrierefrei zugänglich gemacht werden;7.0;7_digitale_digitalisierung_unternehmen_sollen;digitale - digitalisierung - unternehmen - sollen - umsetzung - bürgerinnen - ermöglichen - digitalen - europäischen - verfahren;1.0;1.0;model 1
demzufolge hat mit entsprechenden konsequenzen zu rechnen wer sich nicht an unsere  rechtsordnung hält;0.0;0_prüfung_stärkung_schaffung_evaluierung;prüfung - stärkung - schaffung - evaluierung - ziel - berücksichtigung - sicherheit - polizei - unternehmen - möglichkeit;1.0;1.0;model 2
diese verwaltung ist im dienste der bevölkerung sowie  der unternehmen in unserem land tätig wir setzen uns  als bundesregierung daher für einen leistungsstarken  effizienten sowie nachhaltig und serviceorientiert agierenden öffentlichen sektor ein durch ziel und wirkungsorientiertes arbeiten sowie modernisierung soll in enger  kooperation mit den öffentlich bediensteten sichergestellt  werden dass die hohe qualität der erbrachten leistungen  den bürgerinnen und bürgern auch künftig niederschwellig  zur verfügung gestellt sowie bürokratie serviceorientiert  weiter vereinfacht werden kann;0.0;0_prüfung_stärkung_schaffung_evaluierung;prüfung - stärkung - schaffung - evaluierung - ziel - berücksichtigung - sicherheit - polizei - unternehmen - möglichkeit;1.0;1.0;model 2
 konkrete zuordnung und damit verantwortung  für die ergebnisse zu den jeweiligen gebietskörperschaften aufgabenentflechtung  schaffung klarer verantwortlichkeiten sowie  prüfung einer stärkung der steuer  au tonomie für  länder und gemeinden  reduktion der transferströme wichtig ist dabei  vor allem dass wechselwirkungen im finanzausgleich beachtet werden;0.0;0_prüfung_stärkung_schaffung_evaluierung;prüfung - stärkung - schaffung - evaluierung - ziel - berücksichtigung - sicherheit - polizei - unternehmen - möglichkeit;1.0;1.0;model 2
 im rahmen der avereinbarung zur energieeffizienz werden bezugsgrößen wie total costs of  ownership implementiert;3.0;3_maßnahmen_klimaschutz_sollen_mikroplastik;maßnahmen - klimaschutz - sollen - mikroplastik - öffentliche - unternehmen - ziel - verbindliche - sanierung - gas;1.0;1.0;model 2
 entwicklung eines masterplanes  unterstützung der weiterbildung von ehrenamtlichen mitarbeiterinnen und mitarbeitern  koordinierung der bibliotheken bei der  anschaffung von lizenzen  erweiterung der öffnungszeiten sonntagsöffnung der österreichischen nationalbibliothek önb  verwertungsgesellschaften  umfassende evaluierung der verwertungsgesellschaften vor allem hinsichtlich wirtschaftlicher synergien und transparenz im interesse der  urheberinnen und urheber  stärkung der aufsichtsbehörde  vereinfachte verfahren bei lizenzvergaben   kulturpass für menschen mit finanziellen  engpässen in anlehnung an das konzept  hunger auf kunst und kultur gedenkkultur  entwicklung einer gedenkstrategie mit dem ziel die  unterschiedlichen rechtsträger der österreichischen  gedenkstätten sammlungen und museen unter dem  dach des parlaments zusammenzuführen und die  dauerhafte finanzierung sicherzustellen   stärkung des dokumentationsarchivs des österreichischen widerstandes döw und schaffung einer  forschungs und dokumentationsstelle für antisemitismus für den religiös motivierten politischen  extremismus politischer islam und für den rassismus im  jahrhundert  ankauf und weiterentwicklung der gedenkstätte kz  mauthausengusen  stärkung der erinnerungskultur für jugendliche  inner und außerhalb der schulenmedien wir bekennen uns zu einer medienpolitik die grundwerte wie pluralismus unabhängigkeit medien und  pressefreiheit sowie innovation sicherstellt und fördert;5.0;5_forschung_bereich_verwaltung_europäischen;forschung - bereich - verwaltung - europäischen - prüfung - digitalen - grundlagenforschung - open - berücksichtigung - menschen;1.0;1.0;model 2
auch in jenen bereichen für die die nationale klimaschutzpolitik verantwortlich ist wie z  b  verkehr und gebäude  gibt es deutlichen handlungsbedarf angesichts drohender strafzahlungen bei nichterreichung unserer klimaziele  ist eine ambitionierte reduktion nationaler treibhausgasemissionen auch aus finanzieller sicht sinnvoll;3.0;3_maßnahmen_klimaschutz_sollen_mikroplastik;maßnahmen - klimaschutz - sollen - mikroplastik - öffentliche - unternehmen - ziel - verbindliche - sanierung - gas;1.0;1.0;model 2
 bürokratieabbau im vergabeverfahren unter  berücksichtigung des bestbieterprinzips  verfahrensbeschleunigung unter wahrung hoher  qualität  prüfung einer reform des verfahrensrechts im  avg allgemeines verwaltungsverfahrensgesetz  wurde seit  nicht mehr weiterentwickelt  digitalen bescheid ermöglichen kundmachungsvorschriften  fristen bei digitaler einbringung auf  uhr des  entsprechenden tages ausweiten flexibilisierung bei sachverständigen um bei  mangelnder verfügbarkeit zu lange wartefristen  künftig zu vermeiden  veröffentlichungspflicht in papierform in der wiener  zeitung abschaffen  lohnverrechnung vereinfachen   strukturelle vereinfachung der lohnverrechnung  bessere koordinierung der einzelnen player  finanzamt gebietskrankenkasse und gemeinden  harmonisierung der beitrags und bemessungsgrundlage so weit als möglich  reduktion der komplexität und dokumentationserleichterungen  prüfung der vereinfachung und reduktion von  ausnahme und sonderbestimmungen  verpflichtende anführung der dienstgeberabgaben am lohnzettel planungssicherheit und bürokratieabbau bei förderungen z  b  entscheidung über förderanträge  innerhalb definierter fristen objektive wirkungsziele abwicklungskooperationen von bund und  ländern  verhaltenswissenschaftliche erkenntnisse verstärkt nutzen um verwaltungsabläufe effizienter zu  gestalten und bürokratie zu reduzieren verhaltensökonomie  prüfung ob handelsübliche überbegriffe bei warenbezeichnungen z  b  obst gemüse bei den registrierkassen beibehalten werden können um vor allem  kleine und mittlere händlerinnen und händler zu  entlasten mögliche verlängerung der bestehenden  ausnahmen  normenwesen reformieren um hohe österreichische  standards beizubehalten z  b  konsumentenschutz  aber gleichzeitig unnötige mehrausgaben für unternehmen vermeiden  dienstleistungsscheck entbürokratisieren und  digitalisierenepus  kmus mehr als    d er heimischen unternehmen sind kleine  und mittlere unternehmen kmus die für den großteil der  arbeitsplätze in österreich verantwortlich sind  sie bilden  das rückgrat unserer wirtschaft und unseres wohlstands;9.0;9_digitale_digitalisierung_unternehmen_bürgerinnen;digitale - digitalisierung - unternehmen - bürgerinnen - sollen - daten - ermöglichen - digitalen - umsetzung - verfahren;1.0;1.0;model 2
modell schweiz corporate venture fund unter  einbindung österreichischer leitbetriebe oder modell dänemark dachfondsfund of funds  lösung;8.0;8_österreichs_wirtschaft_positionierung_hilfe;österreichs - wirtschaft - positionierung - hilfe - neue - gap - zusammenarbeit - erhalt - entwicklung - bio;1.0;1.0;model 2
bund bundesländer und gemeinden arbeiten gemeinsam  und abgestimmt an der erreichung der klimaziele und  treffen zukunftsentscheidungen die planungssicherheit  für die bevölkerung und die wirtschaft ermöglichen so  sichern wir den wohlstand der österreichischen bevölkerung und die wettbewerbsfähigkeit der österreichischen  wirtschaft es gilt rasch ins tun zu kommen und vorarbeiten aus dem nationalen energie und klimaplan  der bioökonomiestrategie oder dem sachstandsbericht  mobilität umzusetzen;4.0;4_umsetzung_ebene_europa_maßnahmen;umsetzung - ebene - europa - maßnahmen - europäischer - klimaschutz - green - co - weiterentwicklung - erreichung;1.0;1.0;model 2
klimaneutralität bis   ein  klares ziel ein klarer auftrag  parispfad einschlagen mit wissenschaftsbasierter  klimapolitik   pariskompatibles co budget und dementsprechende reduktionspfade um bis spätestens   klimaneutralität in österreich zu erreichen   vorantreiben einer ambitionierten und fortschrittsorientierten klima und energiepolitik in europa und  der welt   österreich positioniert sich konsequent in der  gruppe der klimaschutzvorreiter in europa und  verfolgt eine energiepolitische orientierung an  erneuerbaren energien und klimaschutz;4.0;4_umsetzung_ebene_europa_maßnahmen;umsetzung - ebene - europa - maßnahmen - europäischer - klimaschutz - green - co - weiterentwicklung - erreichung;1.0;1.0;model 2
 bund und länder verständigen sich auf abgestimmte mittel und langfristig ausgerichtete  planbare und gesicherte sowie hinreichend dotierte  klima und energieförderungen für die verschiedenen zielgruppen zur effektiven und effizienten  erreichung der im nekp und diesem regierungsübereinkommen gesteckten ziele;3.0;3_maßnahmen_klimaschutz_sollen_mikroplastik;maßnahmen - klimaschutz - sollen - mikroplastik - öffentliche - unternehmen - ziel - verbindliche - sanierung - gas;1.0;1.0;model 2
im mittelpunkt stehen lebensqualität und wettbewerbsfähigkeit hierfür müssen neue mobilitätskonzepte und innovationen gestärkt werden  u a  auch mit der etablierung von experimentierräumen;7.0;7_verkehr_öffentlichen_einsatz_ausbau;verkehr - öffentlichen - einsatz - ausbau - mobilität - prüfung - bahn - luftfahrt - verkehrs - schiene;1.0;1.0;model 2
 flexible nachfrageorientierte mobilitätsangebote  als ergänzung zu bahn und kraftfahrlinien auf der  letzten meile  mikroöv  absicherung gemeinwohlorientierter mobilitätsdienste dorfbus anrufsammeltaxis etc durch  klare und stabile rahmenbedingungen   bundesweiter ausbau von den öv ergänzenden  parkride bikeride und carsharinglösungen an bahnhöfen in abhängigkeit von der verfügbarkeit attraktiver zubringerdienste um die  angebote des öffentlichen verkehrs für pendlerinnen und pendler zu erweitern und aufzuwerten dafür notwendig ist auch folgendes   neuordnung parkrideregelungen öbb mit  gemeinden und ländern sowie einheitliche  bewirtschaftungs und betriebskriterien von  parkride bikeride und sharingangeboten  bekenntnis zum regionalen schienengebundenen verkehr bzw zu kostengünstigeren  alternativen des öffentlichen verkehrs  ondemandlösungen busse etc  zusammenarbeit mit dem tourismus um  auch dort die sogenannte last mile mittels  öffentlicher verkehrsmittel zu ermöglichen   bahn im fernverkehr zur attraktiven alternative  machen  prüfung der ausweitung des angebots an autoreisezügen wie beispielsweise wieninnsbruck feldkirch berücksichtigung von emobilität  durch lademöglichkeiten auf dem zug  ausbau des nachtzugangebots im fernverkehr innerösterreichisch und zu internationalen  destinationen  verbesserung der fahrradmitnahme im fernverkehr verkehrssicherheit  novelle der straßenverkehrsordnung   evaluierung der stvo auf benachteiligungen des  radfahrens und zufußgehens   abbau von rechtlichen barrieren zum wohle des  sicheren radfahrens sowie zufußgehens  ermöglichung von temporeduktionen in ortskernen und vor schulen sowie an unfallhäufungsstellen auch auf landesstraßen  stärkung des rücksichtnahmeprinzips in der stvo rettungsgasse klarstellung des begriffs stocken  des verkehrs in der stvo etwa durch konkrete  geschwindigkeitsangabe  klarstellung höchstgeschwindigkeit  kmh in  begegnungszonen  verbesserungen der lkwsicherheit   verstärkter fokus auf lkwsicherheit im verkehrssicherheitsbeirat   vertiefende ausbildung der lkwfahrerinnen  und fahrer im rahmen der berufskraftfahreraus und weiterbildung hinsichtlich verkehrssicherheit und toter winkel   bewusstseinsbildungsmaßnahmen für  besonders gefährdete gruppen von verkehrsteilnehmerinnen und teilnehmern betreffend  toter winkel  prüfung einer förderung für nachrüstung von  abbiegeassistenten  ausstattung von asfinagparkplätzen mit  einrichtungen zur korrekten ausrichtung der  spiegel von lkws sowie kontaktaufnahme und  gemeinsame evaluierung mit den mineralölfirmen ob die einrichtung solcher plätze auch bei  tankstellen möglich ist  adäquate personelle ausstattung der exekutive  für ein dichtes kontrollnetz bezüglich arbeitsrechtlicher technischer und rechtlicher belange  unter zumutbarer zeitlicher beeinträchtigung der  beamtshandelten  einführung einer verpflichtenden verkehrserziehung  inklusive einheitlicher unterrichtsmaterialen sowie  verpflichtende erstehilfekurse in allen schulen  verstärktes angebot von fort und weiterbildung  für führerscheinbesitzerinnen und besitzer um  aktuelles wissen und bewusstsein technischer und  rechtlicher neuerungen zu gewährleisten evaluierung des alkolocksystems nach ablauf der  fünfjahresfrist versuchsbeginn am  september    effektives einschreiten gegen lenkerinnen und  lenker die sich auf grund von verbotenem suchtgiftkonsum alkoholkonsum sowie des konsums von  nicht fachärztlich verschriebenen psychotropen  stoffen in einem fahruntauglichen zustand befinden  ausarbeitung eines verkehrssicherheitsprogramms  ff mit annäherung an vision zero  evaluierung und novelle der offroadvo und des  kfg in bezug auf den missbräuchlichen einsatz von  traktoren effiziente emobilität jetzt   schienen in die zukunft und mehr  bahn bim  bus  bus bahn  co  innovativ aufeinander abgestimmt benutzerfreundlich  etablierung einer gemeinsamen bestellorganisation  die als servicestelle für den bund die bundesländer  und die verkehrsbünde zur verfügung steht um  synergien zu nutzen und beschaffungskosten zu  minimieren sowie zu einer abgestimmten planung  von bahn und busverkehrsausschreibungen zu  kommen  schaffung einer nationalen buchungsplattform mit  transparenten tarifen inkl vereinheitlichung des  ticketing im öffentlichen verkehr möglichkeit mit  einem ticket mehrere verkehrsdienstleister  von  mikroöv bis schienenfernverkehr zu nutzen um  die kundenzufriedenheit zu steigern sollen die tarif  und automatensysteme harmonisiert werden  vereinheitlichung der wichtigsten tarifnebenbestimmungen und mehr vernetzung bei fahrplangestaltung  fahrgastrechte absichern und ausbauen mitwirkungspflicht für unternehmen an schlichtungsverfahren beibehalten prüfung einbezug einzeltickets  spnv  breitbandausbau entlang pendlerstrecken   bahninfrastruktur plus   evaluierung überarbeitung und ggf aufstockung des öbbrahmenplans   um die fertigstellung des zielnetzes  zu  beschleunigen und dringliche nahverkehrsprojekte in ballungsräumen rasch zu starten   entsprechend der zielrichtung des nekp erfolgt  ausgehend vom basisjahr  im gültigen  rahmenplan  eine investitionssteigerung von    p ro jahr inklusive vorausvalorisierung von    ;7.0;7_verkehr_öffentlichen_einsatz_ausbau;verkehr - öffentlichen - einsatz - ausbau - mobilität - prüfung - bahn - luftfahrt - verkehrs - schiene;1.0;1.0;model 2
technische innovationen insbesondere betreffend ökoeffizienzsteigerung und nutzung von  seilbahnen als verkehrsmittel werden begrüßt;7.0;7_verkehr_öffentlichen_einsatz_ausbau;verkehr - öffentlichen - einsatz - ausbau - mobilität - prüfung - bahn - luftfahrt - verkehrs - schiene;1.0;1.0;model 2
 schwerpunktsetzung im bereich digitalisierung  touristische unternehmen beim umstieg und  beim einsatz digitaler anwendungen unterstützen  verstärkt datenallianzen bilden zwischen einrichtungen im einfluss des bundes zur strategischen weiterentwicklung und gemeinsamen problemlösung im rahmen der aktuellen rechtlichen rahmenbedingungen  egovernmentservices ausbauen um bürokratische prozesse zu vereinfachen   rahmenbedingungen für einen engen sektorübergreifenden austausch schaffen  umsetzung einer digitalisierungsstrategie  flächendeckendes datennetz  nutzung der digitalisierung für entbürokratisierung   schulungen im direkt und plattformbetrieb  tourismusopendataleuchtturmprojekt der  öw  besondere berücksichtigung der regionalen schwerpunkte in der tourismusstrategie im sinne einer  zukunftsfitten tourismusstrategie die auch massentouristischen phänomenen entgegenwirken soll  stichwort overtourism  weiterentwicklung der österreich werbung  das öwnetz im ausland wird immer wichtiger  für das funktionieren des österreichischen  tourismussystems und um die marke urlaub  in österreich in die welt zu tragen um synergien zu nutzen sollen öw und awo zukünftig  ein weltweites netz für die österreichischen  destinationen und betriebe bilden;9.0;9_digitale_digitalisierung_unternehmen_bürgerinnen;digitale - digitalisierung - unternehmen - bürgerinnen - sollen - daten - ermöglichen - digitalen - umsetzung - verfahren;1.0;1.0;model 2
 die öw soll die digitale kommunikation und  gestaltung von reiseerlebnissen forcieren und  der branche digitale kooperationsmöglichkeiten  anbieten;9.0;9_digitale_digitalisierung_unternehmen_bürgerinnen;digitale - digitalisierung - unternehmen - bürgerinnen - sollen - daten - ermöglichen - digitalen - umsetzung - verfahren;1.0;1.0;model 2
wir bekennen uns darüber hinaus zum ziel die finanziellen mittel für die entwicklungs  zu sammenarbeit zu  erhöhen zentrale ziel  s etzungen sind mit partnerländern  und organisationen perspektiven vor ort zu schaffen  humanitäre hilfe in krisenregionen auszubauen einen  verstärkten fokus auf das thema migration zu legen und  mehr möglichkeiten für wirtschaftliche zusammen  a rbeit  auf augenhöhe zu schaffen sowie entwicklungspolitische  bildungsarbeit in öster  r eich aufzuwerten die wirksame  hilfe vor ort  etwa in krisenregionen  ist uns dabei  ein zentrales anliegen um das sich die österreichische  bundesregierung verstärkt kümmern wird;8.0;8_österreichs_wirtschaft_positionierung_hilfe;österreichs - wirtschaft - positionierung - hilfe - neue - gap - zusammenarbeit - erhalt - entwicklung - bio;1.0;1.0;model 2
