Document;Topic;Name;Top_n_words;Probability;Representative_document;model
 initiativen für eine internationale positionierung der  eu als starke akteurin  österreich positioniert sich in der eu für ein neues  miteinander statt rückkehr zu altem gegeneinander;2.0;2_migration_internationaler_eu_österreichs;migration - internationaler - eu - österreichs - europäischen - stärkung - asyl - ebene - einsatz - setzt;1.0;1.0;model 2
 klimaschutzgrüne diplomatie für eine le  b ens  w erte  zukunftwelt   signifikante erhöhung des österreichischen beitrags zum greenclimatefund zusage an un   einführung einer klimabotschafterin bzw eines  klimabotschafters und erstellung eines konzepts  für grüne diplomatie  unterstützung des un global compact corporate sustainability initiative  österreich wird der international renew  a ble  energy agency irena beitreten um seine position als international energy hub auszubauen;4.0;4_umsetzung_ebene_europa_maßnahmen;umsetzung - ebene - europa - maßnahmen - europäischer - klimaschutz - green - co - weiterentwicklung - erreichung;1.0;1.0;model 2
festigung des images von österreich als internationalem amtssitz   ausbau des amtssitzes wien als hub für sicherheit und nachhaltigkeit mit einem fokus auf  energie entwicklung und climate diplomacy  nachhaltige modernisierung des vienna international centers in zusammenarbeit mit der stadt  wien und der uno mit dem ziel einer ausweitung der aktivitäten und organisationen  schaffung eines zeitgemäßen und umfassenden  amtssitzgesetzes um die attraktivität des  standorts österreich weiter zu erhöhen  österreich als ort des dialogs und der internationalen diplomatie weiter stärken sowie die  sichtbarkeit im austausch mit der bevölkerung  erhöhen die bundesregierung wird sich für eine reform  des kaiciid innerhalb eines jahres einsetzen im  sinne einer umfassenden anwendung des artikels  ii des gründungsvertrags des kaiciid sowie einer  stärkeren anbindung an die vereinten nationen und  einer verbreiterung der mitgliedsbasis sollte dies  nicht gelingen wird unter größtmöglicher wahrung  der bedeutung des dialogstandorts österreich und  seiner rolle als verlässlicher amtssitz das ziel des  ausstiegs aus dem kaiciid in enger abstimmung  mit allen vertragsparteien geplant der dialog zwischen religionen und kulturen bleibt für österreich  selbstverständlich weiterhin wesentlich;2.0;2_migration_internationaler_eu_österreichs;migration - internationaler - eu - österreichs - europäischen - stärkung - asyl - ebene - einsatz - setzt;1.0;1.0;model 2
österreich ist ein weltoffenes christlich geprägtes land  mit einem reichen kulturellen und religiösen erbe das  dem humanismus und der aufklärung verpflichtet ist;8.0;8_österreichs_wirtschaft_positionierung_hilfe;österreichs - wirtschaft - positionierung - hilfe - neue - gap - zusammenarbeit - erhalt - entwicklung - bio;1.0;1.0;model 2
verstöße gegen die demokratische grund und werteordnung unseres liberalen staates dürfen nicht relativiert und  hingenommen werden egal aus welcher richtung oder mit  welcher begründung sie kommen gelungene integration  bedeutet auch sich einer gemeinschaft zugehörig zu  fühlen gemeinsam verantwortung in einer demokratischen gesellschaft wahrzunehmen und verbundenheit  mit österreich als neuem heimatland;2.0;2_migration_internationaler_eu_österreichs;migration - internationaler - eu - österreichs - europäischen - stärkung - asyl - ebene - einsatz - setzt;1.0;1.0;model 2
 die positive zusammenarbeit zwischen schule und  eltern ist ein wichtiger bestandteil für einen erfolgreichen bildungsweg des kindes;1.0;1_schulen_weiterentwicklung_pädagogen_hochschulen;schulen - weiterentwicklung - pädagogen - hochschulen - pädagogischen - schülerinnen - evaluierung - elementarpädagogik - ausbau - lehre;1.0;1.0;model 2
wo familien nicht selbst z  b  durch erwerbsbeteiligung  für die finanzielle absicherung sorgen können wird diese  durch sozialleistungen sichergestellt außerdem wird der  kindermehrbetrag des familienbonus erhöht und allen  erwerbstätigen mit kindern als negativsteuer ausbezahlt;6.0;6_pflege_familien_ausbau_kinder;pflege - familien - ausbau - kinder - versorgung - menschen - betreuung - pflegende - maßnahmen - angehörige;1.0;1.0;model 2
ärztinnen und ärzten die aufwertung von diplomierten  gesundheits und pflegefachkräften sowie deren optimierte zusammenarbeit in neuen versorgungsformen dies  beinhaltet auch den ausbau der primärversorgungseinheiten zur zielgerichteten inanspruchnahme medi  z inischer  und therapeutischer leis  t ungen einschreibmodelle mit  anreizsystemen sind für alle patientinnen und patienten  zu etablieren um die zusammenarbeit der gesundheitsberufe zu verbessern sollen auch neue gesundheits und  sozialberufe gestärkt werden psychotherapeutische  leistungen ausgeweitet und ein besonderer fokus auf  kindergesundheit gelegt werden;6.0;6_pflege_familien_ausbau_kinder;pflege - familien - ausbau - kinder - versorgung - menschen - betreuung - pflegende - maßnahmen - angehörige;1.0;1.0;model 2
familien in krisensituationen müssen die notwendige  hilfe erhalten und alleinerziehende und krisenpflegeeltern besser abgesichert werden ein lückenschluss  beim unterhaltsvorschuss soll sicherstellen dass eltern  nicht mit langwierigen verfahren belastet werden eine  zeitverwendungsstudie bezahlte vs unbezahlte arbeit  aufteilung familienarbeit familienkosten kinderkosten  wird durchgeführt kinder und jugendliche sollen zu eigenverantwortlichen  bürgerinnen und bürgern heranwachsen deshalb gilt  es aktive partizipation an gesellschaftlichen und demokratischen prozessen zu fördern und ihnen die dafür notwendigen instrumente in die hand zu geben wir wollen  aktive partizipation stärken das betriebsratswahlalter  auf  jahre senken sowie schüler lehrlings und jugendparlamente weiter aufwerten eigenverantwortung  ist jedoch auch im hinblick auf den umgang mit medien  und sozialen netzwerken von bedeutung die neben all  den sich bietenden chancen auch zunehmend zur gefahr  für kinder und jugendliche werden können hier gilt es  jugendliche zu sensibilisieren und den richtigen umgang  mit medien zu vermitteln;6.0;6_pflege_familien_ausbau_kinder;pflege - familien - ausbau - kinder - versorgung - menschen - betreuung - pflegende - maßnahmen - angehörige;1.0;1.0;model 2
neben den betroffenen schülerinnen und schülern werden  besonders die pädagoginnen und pädagogen im zentrum  unserer bemühungen stehen sie leisten hervorragende  arbeit und verdienen dabei weitere unterstützung für ihre  verantwortungsvollen aufgaben darüber hinaus werden  wir die berufsbildung für die fachkräfte der zukunft  stärken und das angebot für lebensbegleitende erwachsenenbildung ausbauen wir wollen rahmenbedingungen  für alle kinder und jugendlichen zur verfügung stellen die  leistung ebenso ermöglichen wie kreativität bewegung  und die entwicklung sozialer fähigkeitenstärkung der elementaren bildung  errichtung eines beirates für elementarpädagogik  mitglieder dieses beirats sind ngosexpertinnen  und experten länder sowie gemeinden zur förderung der österreichweiten zusammenarbeit und  um vorschläge für einheitliche qualitätsmindeststandards in der elementarpädagogik zu erarbeiten;1.0;1_schulen_weiterentwicklung_pädagogen_hochschulen;schulen - weiterentwicklung - pädagogen - hochschulen - pädagogischen - schülerinnen - evaluierung - elementarpädagogik - ausbau - lehre;1.0;1.0;model 2
 weiterentwicklung des fachhochschulsektors   der fachhochschulsektor soll gezielt weiterentwickelt werden um eine gute datenlage zu  erhalten ist ein umfassendes erhebungs und  analysepaket erforderlich das jedenfalls die  personal kosten und organisationsstruktur  studienangebote und die aufnahmeverfahren  umfasst;1.0;1_schulen_weiterentwicklung_pädagogen_hochschulen;schulen - weiterentwicklung - pädagogen - hochschulen - pädagogischen - schülerinnen - evaluierung - elementarpädagogik - ausbau - lehre;1.0;1.0;model 2
 governance der wichtigsten österreichischen  förderinstitute verbessern ffg forschungsförderungsgesellschaft fwf wissenschaftsfonds aws  austria wirtschaftsservice oead österreichischer austauschdienst und cdg christian doppler  forschungsgesellschaft sowie in zukunft die lbg  ludwig boltzmann gesellschaft  ziel einer klaren aufgabenteilung zwischen der  förderung von grundlagenforschung fwf  angewandter forschung ffg und wirtschaftsförderung aws sowie größtmöglicher gemeinsamer abdeckung von forschung und entwicklung enge abstimmung mit den verantwortlichen  ministerien zu strategischer zielsetzung und  gesamtgesellschaftlichen prioritäten aufbauend  auf ftistrategie und standortstrategie bei  verstärkter autonomie in der operativen umsetzung weg von zahlreichen einzelprogrammen  hin zu größeren programmlinien  christian doppler forschungsgesellschaft cdg  die cdg ist sehr erfolgreich an der schnittstelle  von universitäten und unternehmen tätig die  weiterführung dieses erfolgreichen weges soll auch  in zukunft gesichert sein als vorbildprogramm im  bereich sciencetobusiness;5.0;5_forschung_bereich_verwaltung_europäischen;forschung - bereich - verwaltung - europäischen - prüfung - digitalen - grundlagenforschung - open - berücksichtigung - menschen;1.0;1.0;model 2
verankerung des einsatzes des elaks im egovg  einheitlicher itarbeitsplatz und einheitliches  emailsystem im bund  nutzen von synergien um kosten in der verwaltung bei der it einzusparen  erhöhte sicherheit durch gemeinsame standards  prüfung von konsolidierungs und optimierungsmöglichkeiten durch die bundescloud  gemeinsame beschaffung von hard und software im bund  einheitliches lizenzmanagement  prüfung einer verstärkten zusammenarbeit des bundesrechenzentrums brz und der statistik austria   weiterentwicklung des brz in ein kompetenzzentrum für digitalisierung in der bundesverwaltung   entwicklung eines konzepts für green it im bund  ziel ist es den energieverbrauch der it des bundes  und seiner tochterorganisationen durch energiesparende hardware betriebssysteme und anwendungssoftware abzusenken;5.0;5_forschung_bereich_verwaltung_europäischen;forschung - bereich - verwaltung - europäischen - prüfung - digitalen - grundlagenforschung - open - berücksichtigung - menschen;1.0;1.0;model 2
 im rahmen seiner mitgliedschaft im vnmenschenrechtsrat bis ende dezember  wird österreich  aktiv zur entwicklung und stärkung des internationalen menschenrechtsschutzes beitragen;0.0;0_österreichs_stärkung_eu_kunst;österreichs - stärkung - eu - kunst - kultur - integration - zusammenarbeit - ebene - europäischen - migration;1.0;1.0;model 3
 stärkung der staatsanwaltschaften zur unabhängigen ermittlungsarbeit im verfassungsrechtlichen  rahmen durch  entfall von vermeidbaren berichten   transparenz von erledigungsdauer des internen  berichtswesens im rahmen des ermittlungsaktes stärkung der fachlichen ressourcen insbesondere it und wirtschaftsexpertise  stärkung der stellung der gruppenleiterin bzw;1.0;1_prüfung_evaluierung_stärkung_schaffung;prüfung - evaluierung - stärkung - schaffung - polizei - berücksichtigung - sicherheit - möglichkeit - weiterentwicklung - rahmen;1.0;1.0;model 3
teilleugnung  prüfung einer möglichkeit der einziehung von  nsdevotionalien unabhängig von der verwirklichung einer mit strafe bedrohten handlung und  evaluierung des abzeichengesetzes  stärkung von sicherheit rechtsfrieden und des  schutzes der höchsten rechtsgüter nicht nur in der  analogen welt sondern auch in der digitalen welt  erarbeitung zeitgemäßer und erweiterung bzw;1.0;1_prüfung_evaluierung_stärkung_schaffung;prüfung - evaluierung - stärkung - schaffung - polizei - berücksichtigung - sicherheit - möglichkeit - weiterentwicklung - rahmen;1.0;1.0;model 3
österreichischen und europäischen  medienstandort stärken  förderwesen weiterentwickeln  schaffung eines medienfonds avmdrichtlinie  nutzen ziele der mittelverwendung definieren  umsetzung copyrightrichtlinie  schutz geistigen eigentums  reform der verwertungsgesellschaften im  interesse der künstlerinnen und künstler sowie  anderer urheberinnen und urheber  digitalisierungsförderung  geld für wandel  projektbezogene förderung nach festgelegten  kriterien  prüfung aller medienrelevanten gesetze mit dem  ziel einer harmonisierung und vereinfachung  überprüfung der derzeitigen vergabe und  förderkriterien  überprüfung der kriterien der inseratenvergabe der öffentlichen verwaltung und  staatsnaher unternehmen  überprüfung des medientransparenzgesetzes  überprüfung der dotierung des nichtkommerziellen rundfunkfonds nkrf mit dem ziel einer  erhöhung im hinblick auf entwicklung innovativer medienformen  kampf gegen hass im netz   große plattformen  löschung von rechtswidrigen inhalten wirksame beschwerdeverfahren  klar definierte verantwortliche  schutz vor desinformation  wirtschaftliche kooperation ermöglichen  überprüfung des wettbewerbsrechts hinsichtlich kartellrechtlicher bestimmungen in der medienlandschaft  einsatz für zeitgemäße europäische regulierung   überarbeitung der ecommercerichtlinie  neues geschäftsmodell der wiener zeitung mit  dem ziel des erhalts der marke  serviceplattformen des bundes bündeln  kooperation der dualen   medienlandschaft  medienstandort  österreich stärken  wir stehen für einen unabhängig finanzierten  öffentlichrechtlichen rundfunk notwendig ist  die gesetzliche verankerung der stärkeren zusammenarbeit zwischen orf und privaten sowie die  anpassung des öffentlichrechtlichen auftrags an  das digitale zeitalter unter berücksichtigung der  europarechtlichen rahmenbedingungen wobei  ein besonderer schwerpunkt auf regionale vielfalt  gelegt werden soll;7.0;7_forschung_bereich_verwaltung_prüfung;forschung - bereich - verwaltung - prüfung - digitalen - grundlagenforschung - open - berücksichtigung - sicherzustellen - europäischen;1.0;1.0;model 3
die bundesregierung bekennt sich zu einer finanz und  budgetpolitik die fiskalische stabilität sicherstellt und  den heimischen unternehmerinnen bzw unternehmern  und arbeitnehmerinnen bzw arbeitnehmern planungssicherheit bietet der staat soll dabei mit gutem beispiel  vorangehen und mit dem geld der steuerzahlenden sorgsam umgehen während er überall dort wo es sinnvoll und  notwendig ist spielräume schafft um durch öffentliche  investitionen das allgemeinwohl zu fördern;4.0;4_bekennt_verantwortung_menschen_prüfung;bekennt - verantwortung - menschen - prüfung - arbeit - gemeinsame - ziel - gemeinden - gebietskörperschaften - schaffung;1.0;1.0;model 3
ökologisierung vorantreiben  erarbeitung eines modells zur aktiven beratung von  gemeinden und ländern hinsichtlich ökologischer  und nachhaltiger infrastrukturprojekte und sanierungsmaßnahmen sowie deren finanzierung unter  einhaltung des innerösterreichischen stabilitätspaktes  green supporting factor auf europäischer ebene  im kampf gegen den klimawandel werden wir auch  den tatkräftigen beitrag von startups und kmus  brauchen die jene innovationen beschleunigen  die uns ein co neutrales leben und wirtschaften  ermöglichen die bundesregierung wird sich daher  auf europäischer ebene dafür einsetzen dass  banken für kredite die effektiv dazu beitragen den  übergang zu einer nachhaltigen klimaneutralen  wirtschaft zu beschleunigen weniger eigenkapital  hinterlegen müssen ein solcher green supporting  factor würde die vergabe von grünen krediten  erleichtern und somit einen wertvollen beitrag zur  erreichung unserer europäischen klimaziele leisten;5.0;5_umsetzung_ebene_europa_maßnahmen;umsetzung - ebene - europa - maßnahmen - europäischer - klimaschutz - green - co - weiterentwicklung - erreichung;1.0;1.0;model 3
apps für terminerinnerungen oder mobile zahlungsmöglichkeiten einziehungsauftrag für abgabenschulden  weitere modernisierung der steuer und zollverwaltung strukturelle reform unter berücksichtigung  der möglichkeiten der digitalisierung effizientere  elektronische abwicklung   digitaler datenaustausch auf basis international  anerkannter standards für unternehmen insbesondere kmu wird die technische möglichkeit zur  übermittlung der daten des rechnungswesens für  digitale prüfung geschaffen auf freiwilliger basis  und unter wahrung des datenschutzes;9.0;9_digitale_digitalisierung_unternehmen_sollen;digitale - digitalisierung - unternehmen - sollen - bürgerinnen - ermöglichen - digitalen - umsetzung - verfahren - optimierung;1.0;1.0;model 3
 im dialog mit den bundesländern energieversorgern  und gasnetzbetreibern ist ein fahrplan zur stufenweisen entflechtung der wärmenetze zu entwickeln;3.0;3_maßnahmen_klimaschutz_sollen_unternehmen;maßnahmen - klimaschutz - sollen - unternehmen - öffentliche - sanierung - verbindliche - mikroplastik - ziel - prüfung;1.0;1.0;model 3
 kein weiterer ausbau von gasnetzen zur raumwärmeversorgung ausgenommen verdichtung  innerhalb bestehender netze  wärmestrategie erstellen in enger zusammenarbeit  mit den bundesländern erarbeitet die bundesregierung eine österreichische wärmestrategie mit der  zielsetzung der vollständigen dekarbonisierung des  wärmemarktes;5.0;5_umsetzung_ebene_europa_maßnahmen;umsetzung - ebene - europa - maßnahmen - europäischer - klimaschutz - green - co - weiterentwicklung - erreichung;1.0;1.0;model 3
 die laufzeiten für die gewährung der marktprämien  werden generell auf  jahre ausgedehnt die errichtung von pvanlagen und das ziel  million  dächer mit photovoltaik auszustatten wird durch  folgende änderungen administrativ erleichtert   abbau von bürokratischen hürden bei bestehenden anlagen dazu gehört die ermöglichung der  erweiterung bestehender anlagen ohne dass  ein einspeisetarifverlust für die bisherige kapazität eintritt  vereinfachter netzzugang für anlagen bis  kw  ausweitung der leistungsbezogenen fördergrenzen  vereinfachung der rechtlichen rahmenbedingungen für pvanlagen  förderfähigkeit auch auf flächen außerhalb von  gebäuden mit besonderem fokus auf versiegelte flächen z  b  pranlagen parkplätze etc  und doppelnutzung  prüfung der tarifstruktur auf änderungsbedarf um  abzufedern dass unterschiedliche ausgangsbedingungen in bezug auf den nächsten verfügbaren  netzanschlusspunkt zu benachteiligungen bei den  kontrahierungen von erzeugungskapazitäten führen  erweiterung der möglichkeiten der gestaltung von  erneuerbaren energiegemeinschaften und bürgerenergiegemeinschaften für verstärkte dezentrale  energieversorgung und die stärkung von regionalen  versorgungskonzepten mit fokus auf gemeinnützigkeit und genossenschaftliche systeme lokale  mikronetze und speicherbetreiber etablierung  eines onestopshops zur beratung  ermöglichung einer unkomplizierten direktvermarktung bei eigenstromerzeugungen sofern das  öffentliche netz nicht benutzt wird  streichung der eigenstromsteuer auf alle erneuerbaren energieträger  forcierung der revitalisierung großer wasserkraftanlagenweiterentwicklung des   energieeffizienzgesetzes novellierung des energieeffizienzgesetzes auf basis der  folgenden grundsätze  einsparungen werden weiterhin mit einer kombination aus strategischen maßnahmen steuerrecht  ordnungsrecht förderungen und einer verpflichtung der energielieferanten einsparmaßnahmen zu  setzen erzielt;3.0;3_maßnahmen_klimaschutz_sollen_unternehmen;maßnahmen - klimaschutz - sollen - unternehmen - öffentliche - sanierung - verbindliche - mikroplastik - ziel - prüfung;1.0;1.0;model 3
 besondere berücksichtigung finden attraktive  mobilitätsdienstleistungen sowohl für urbane  zentren als auch für ländliche gebiete;8.0;8_verkehr_öffentlichen_einsatz_ausbau;verkehr - öffentlichen - einsatz - ausbau - mobilität - prüfung - bahn - luftfahrt - verkehrs - schiene;1.0;1.0;model 3
